{
  "ontologyVersion": "v1",
  "id": "00000000-0000-4000-a000-000000000001",
  "claimRef": "11111111-1111-4111-a111-111111111111",
  "validFrom": "2026-01-01",
  "validTo": "2026-06-01",
  "recordedAt": "2026-06-02T12:00:00Z",
  "value": {
    "persons": [
      {
        "id": "22222222-2222-4222-a222-222222222222",
        "birthDate": "1959-03-15",
        "nationality": "chilena",
        "income": {
          "net_salary": {
            "value": 5245000,
            "unit": "CURRENCY_CLP",
            "basis": {
              "unit": "CURRENCY_CLP",
              "type": "real",
              "basePeriod": "2026-06",
              "asOf": "2026-06-01"
            },
            "income_semantics": "net_of_afp_and_health"
          }
        }
      }
    ],
    "household": {
      "id": "household-001",
      "members": ["22222222-2222-4222-a222-222222222222"]
    }
  }
}
